{
  "id": "part:nxp-pct2075d-118",
  "identity_evidence": {
    "page": 3,
    "source": "source:nxp-pct2075"
  },
  "manufacturer": "NXP Semiconductors",
  "mpn": "PCT2075D,118",
  "package": "package:nxp-pct2075d-so8",
  "parameters": {
    "input_current": {
      "basis": "DATASHEET",
      "conditions": {},
      "evidence": {
        "page": 20,
        "source": "source:nxp-pct2075"
      },
      "max": 0.0004,
      "note": "Average supply current, normal mode with I2C active at 1000 kHz. Typical 200 uA at 3.3 V and 25 degrees C; maximum 400 uA over VCC 2.7–5.5 V and ambient -55 to +125 degrees C.",
      "typ": 0.0002,
      "unit": "A"
    },
    "input_voltage": {
      "basis": "DATASHEET",
      "conditions": {},
      "evidence": {
        "page": 19,
        "source": "source:nxp-pct2075"
      },
      "max": 5.5,
      "min": 2.7,
      "unit": "V"
    }
  },
  "pin_evidence": {
    "basis": "DATASHEET",
    "page": 5,
    "source": "source:nxp-pct2075"
  },
  "pins": [
    {
      "name": "SDA",
      "number": "1",
      "type": "OPEN_DRAIN"
    },
    {
      "name": "SCL",
      "number": "2",
      "type": "INPUT"
    },
    {
      "name": "OS",
      "number": "3",
      "type": "OPEN_DRAIN"
    },
    {
      "name": "GND",
      "number": "4",
      "type": "GROUND"
    },
    {
      "name": "A2",
      "number": "5",
      "type": "INPUT"
    },
    {
      "name": "A1",
      "number": "6",
      "type": "INPUT"
    },
    {
      "name": "A0",
      "number": "7",
      "type": "INPUT"
    },
    {
      "name": "VCC",
      "number": "8",
      "type": "POWER_IN"
    }
  ],
  "provenance": {
    "created_by": "agent:/root/implement_pcbknowledge_brief/stage6_audit_packages",
    "verified_by": [
      "agent:/root/implement_pcbknowledge_brief/stage6_package_review"
    ]
  },
  "roles": [
    "sensor.temperature"
  ],
  "schema": "pcbknowledge.part.v2",
  "sourcing": {
    "lifecycle": "UNKNOWN"
  },
  "verification": "AGENT_VERIFIED"
}
