{
  "id": "part:kemet-c0603c220j5gactu",
  "identity_evidence": {
    "page": 1,
    "source": "source:kemet-c0603c220j5gactu"
  },
  "manufacturer": "KEMET",
  "mpn": "C0603C220J5GACTU",
  "package": "package:chip-0603-kemet-c0g",
  "parameters": {
    "capacitance": {
      "basis": "DATASHEET",
      "conditions": {},
      "evidence": {
        "page": 1,
        "source": "source:kemet-c0603c220j5gactu"
      },
      "max": 2.31e-11,
      "min": 2.09e-11,
      "note": "Measured at 1 MHz, 1 Vrms; 5% capacitance tolerance.",
      "typ": 2.2e-11,
      "unit": "F"
    },
    "voltage_rating": {
      "basis": "DATASHEET",
      "conditions": {},
      "evidence": {
        "page": 1,
        "source": "source:kemet-c0603c220j5gactu"
      },
      "max": 50,
      "unit": "V"
    }
  },
  "pin_evidence": {
    "basis": "STANDARD_CONVENTION",
    "convention": "Unpolarized two-terminal component: terminals numbered 1 and 2.",
    "page": 1,
    "source": "source:kemet-c0603c220j5gactu"
  },
  "pins": [
    {
      "name": "1",
      "number": "1",
      "type": "PASSIVE"
    },
    {
      "name": "2",
      "number": "2",
      "type": "PASSIVE"
    }
  ],
  "provenance": {
    "created_by": "agent:/root/implement_pcbknowledge_brief/curate_g1_parts",
    "verified_by": [
      "agent:/root/implement_pcbknowledge_brief/implement_footprint_contracts"
    ]
  },
  "roles": [
    "capacitor.ceramic"
  ],
  "schema": "pcbknowledge.part.v2",
  "sourcing": {
    "lifecycle": "UNKNOWN"
  },
  "verification": "AGENT_VERIFIED"
}
