{
  "id": "part:yageo-rt0603brd0710kl",
  "identity_evidence": {
    "page": 1,
    "source": "source:yageo-rt0603brd0710kl"
  },
  "manufacturer": "Yageo",
  "mpn": "RT0603BRD0710KL",
  "package": "package:yageo-rt0603brd0710kl",
  "parameters": {
    "power_rating": {
      "basis": "DATASHEET",
      "conditions": {},
      "evidence": {
        "page": 1,
        "source": "source:yageo-rt0603brd0710kl"
      },
      "max": 0.1,
      "note": "At70degC.",
      "unit": "W"
    },
    "resistance": {
      "basis": "DATASHEET",
      "conditions": {},
      "evidence": {
        "page": 1,
        "source": "source:yageo-rt0603brd0710kl"
      },
      "max": 10010,
      "min": 9990.0,
      "typ": 10000,
      "unit": "ohm"
    }
  },
  "pin_evidence": {
    "basis": "STANDARD_CONVENTION",
    "convention": "Unpolarized two-terminal component: terminals numbered 1 and 2.",
    "page": 1,
    "source": "source:yageo-rt0603brd0710kl"
  },
  "pins": [
    {
      "name": "1",
      "number": "1",
      "type": "PASSIVE"
    },
    {
      "name": "2",
      "number": "2",
      "type": "PASSIVE"
    }
  ],
  "provenance": {
    "created_by": "agent:/root/research_fixed_themes",
    "notes": "Exact manufacturer individual specification, physical page 1.",
    "verified_by": [
      "agent:/root/implement_reference_layout/stage12_review"
    ]
  },
  "roles": [
    "resistor"
  ],
  "schema": "pcbknowledge.part.v2",
  "sourcing": {
    "lifecycle": "UNKNOWN"
  },
  "verification": "AGENT_VERIFIED"
}
