{
  "id": "part:yageo-rl1206fr-070r1l",
  "identity_evidence": {
    "page": 1,
    "source": "source:yageo-rl1206fr-070r1l"
  },
  "manufacturer": "Yageo",
  "mpn": "RL1206FR-070R1L",
  "package": "package:chip-1206-yageo-rl",
  "parameters": {
    "power_rating": {
      "basis": "DATASHEET",
      "conditions": {},
      "evidence": {
        "page": 1,
        "source": "source:yageo-rl1206fr-070r1l"
      },
      "max": 0.25,
      "note": "Rated at 70 degC.",
      "unit": "W"
    },
    "resistance": {
      "basis": "DATASHEET",
      "conditions": {},
      "evidence": {
        "page": 1,
        "source": "source:yageo-rl1206fr-070r1l"
      },
      "max": 0.101,
      "min": 0.099,
      "typ": 0.1,
      "unit": "ohm"
    }
  },
  "pin_evidence": {
    "basis": "STANDARD_CONVENTION",
    "convention": "Unpolarized two-terminal component: terminals numbered 1 and 2.",
    "page": 1,
    "source": "source:yageo-rl1206fr-070r1l"
  },
  "pins": [
    {
      "name": "1",
      "number": "1",
      "type": "PASSIVE"
    },
    {
      "name": "2",
      "number": "2",
      "type": "PASSIVE"
    }
  ],
  "provenance": {
    "created_by": "agent:/root/implement_pcbknowledge_brief/curate_g1_parts",
    "verified_by": [
      "agent:/root/implement_pcbknowledge_brief/curate_g1_parts/curate_g1_mcu_peripherals"
    ]
  },
  "roles": [
    "resistor"
  ],
  "schema": "pcbknowledge.part.v2",
  "sourcing": {
    "lifecycle": "UNKNOWN"
  },
  "verification": "AGENT_VERIFIED"
}
