{
  "id": "part:tdk-clf7045nit-101m-d",
  "identity_evidence": {
    "page": 1,
    "source": "source:tdk-clf7045ni-d"
  },
  "manufacturer": "TDK",
  "mpn": "CLF7045NIT-101M-D",
  "package": "package:tdk-clf7045ni-d",
  "parameters": {
    "current_rating": {
      "basis": "DATASHEET",
      "conditions": {},
      "evidence": {
        "page": 1,
        "source": "source:tdk-clf7045ni-d"
      },
      "note": "Typical current for40degC self-heating; not a guaranteed thermal maximum. Rated current is smaller ofIsat andItemp.",
      "typ": 1.05,
      "unit": "A"
    },
    "inductance": {
      "basis": "DATASHEET",
      "conditions": {
        "frequency": {
          "unit": "Hz",
          "value": 100000
        }
      },
      "evidence": {
        "page": 1,
        "source": "source:tdk-clf7045ni-d"
      },
      "max": 0.00012,
      "min": 8e-05,
      "typ": 0.0001,
      "unit": "H"
    },
    "resistance": {
      "basis": "DATASHEET",
      "conditions": {},
      "evidence": {
        "page": 1,
        "source": "source:tdk-clf7045ni-d"
      },
      "max": 0.312,
      "min": 0.208,
      "typ": 0.26,
      "unit": "ohm"
    },
    "saturation_current": {
      "basis": "DATASHEET",
      "conditions": {},
      "evidence": {
        "page": 1,
        "source": "source:tdk-clf7045ni-d"
      },
      "max": 0.81,
      "note": "Manufacturer rated-current maximum for30% inductance decrease from nominal. Separate1.10A typical characterization is not substituted as guaranteedlimit.",
      "unit": "A"
    },
    "temperature": {
      "basis": "DATASHEET",
      "conditions": {},
      "evidence": {
        "page": 4,
        "source": "source:tdk-clf7045ni-d"
      },
      "max": 150,
      "min": -55,
      "note": "Includes self-temperature rise.",
      "unit": "degC"
    }
  },
  "pin_evidence": {
    "basis": "STANDARD_CONVENTION",
    "convention": "Unpolarized two-terminal component: terminals numbered 1 and 2.",
    "page": 4,
    "source": "source:tdk-clf7045ni-d"
  },
  "pins": [
    {
      "name": "1",
      "number": "1",
      "type": "PASSIVE"
    },
    {
      "name": "2",
      "number": "2",
      "type": "PASSIVE"
    }
  ],
  "provenance": {
    "created_by": "agent:/root/implement_pcbknowledge_brief/g2_passive_author",
    "verified_by": [
      "agent:/root/implement_pcbknowledge_brief/g2_source_review"
    ]
  },
  "roles": [
    "passive.inductor"
  ],
  "schema": "pcbknowledge.part.v2",
  "sourcing": {
    "lifecycle": "UNKNOWN"
  },
  "verification": "AGENT_VERIFIED"
}
