{
  "id": "part:amphenol-10155435-00011lf",
  "identity_evidence": {
    "page": 1,
    "source": "source:amphenol-10155435"
  },
  "manufacturer": "Amphenol FCI",
  "mpn": "10155435-00011LF",
  "package": "package:amphenol-10155435",
  "parameters": {
    "current_rating": {
      "basis": "DATASHEET",
      "conditions": {},
      "evidence": {
        "page": 1,
        "source": "source:amphenol-10155435"
      },
      "note": "Lower of drawing ratings: 3 A for special contact material versus 5 A for C1814. Exact contact material is not encoded by the displayed orderable suffix; do not claim 5 A.",
      "unit": "A",
      "value": 3
    },
    "thickness": {
      "basis": "DATASHEET",
      "conditions": {},
      "evidence": {
        "page": 1,
        "source": "source:amphenol-10155435"
      },
      "note": "Manufacturer recommended PCB thickness0.80mm. Not selected for G1 1.6mm fabrication profile; no1.6mm compatibility is asserted.",
      "unit": "mm",
      "value": 0.8
    },
    "voltage_rating": {
      "basis": "DATASHEET",
      "conditions": {},
      "evidence": {
        "page": 1,
        "source": "source:amphenol-10155435"
      },
      "unit": "V",
      "value": 5
    }
  },
  "pin_evidence": {
    "basis": "DATASHEET",
    "note": "Shared mating-contact labels are joined with underscores for each physical solder terminal. SHELL1-4 name the four unnumbered shell slots; MH1-2 name the two unplated mounting holes. These are local physical identifiers, not manufacturer contact numbers.",
    "page": 1,
    "source": "source:amphenol-10155435"
  },
  "pins": [
    {
      "name": "GND",
      "number": "A1_B12",
      "type": "GROUND"
    },
    {
      "name": "VBUS",
      "number": "A4_B9",
      "type": "PASSIVE"
    },
    {
      "name": "SBU2",
      "number": "B8",
      "type": "PASSIVE"
    },
    {
      "name": "CC1",
      "number": "A5",
      "type": "PASSIVE"
    },
    {
      "name": "DM2",
      "number": "B7",
      "type": "PASSIVE"
    },
    {
      "name": "DP1",
      "number": "A6",
      "type": "PASSIVE"
    },
    {
      "name": "DM1",
      "number": "A7",
      "type": "PASSIVE"
    },
    {
      "name": "DP2",
      "number": "B6",
      "type": "PASSIVE"
    },
    {
      "name": "SBU1",
      "number": "A8",
      "type": "PASSIVE"
    },
    {
      "name": "CC2",
      "number": "B5",
      "type": "PASSIVE"
    },
    {
      "name": "VBUS",
      "number": "B4_A9",
      "same_net_as": "A4_B9",
      "type": "PASSIVE"
    },
    {
      "name": "GND",
      "number": "B1_A12",
      "same_net_as": "A1_B12",
      "type": "GROUND"
    },
    {
      "name": "SHIELD",
      "number": "SHELL1",
      "type": "PASSIVE"
    },
    {
      "name": "SHIELD",
      "number": "SHELL2",
      "same_net_as": "SHELL1",
      "type": "PASSIVE"
    },
    {
      "name": "SHIELD",
      "number": "SHELL3",
      "same_net_as": "SHELL1",
      "type": "PASSIVE"
    },
    {
      "name": "SHIELD",
      "number": "SHELL4",
      "same_net_as": "SHELL1",
      "type": "PASSIVE"
    },
    {
      "name": "MOUNT",
      "number": "MH1",
      "type": "NO_CONNECT"
    },
    {
      "name": "MOUNT",
      "number": "MH2",
      "type": "NO_CONNECT"
    }
  ],
  "provenance": {
    "created_by": "agent:/root/implement_pcbknowledge_brief/curate_g1_parts/curate_g1_mcu_peripherals",
    "verified_by": [
      "agent:/root"
    ]
  },
  "roles": [
    "connector.usb-c-sink"
  ],
  "schema": "pcbknowledge.part.v2",
  "sourcing": {
    "lifecycle": "UNKNOWN"
  },
  "verification": "AGENT_VERIFIED"
}
