{
  "id": "part:rohm-bd79124muf-ce2",
  "identity_evidence": {
    "page": 38,
    "source": "source:rohm-bd79124muf-c"
  },
  "manufacturer": "ROHM",
  "mpn": "BD79124MUF-CE2",
  "package": "package:rohm-vqfn16fv3030",
  "parameters": {
    "analog_input_voltage": {
      "basis": "DATASHEET",
      "conditions": {
        "input_voltage": {
          "unit": "V",
          "value": 3.3
        }
      },
      "evidence": {
        "page": 5,
        "source": "source:rohm-bd79124muf-c"
      },
      "max": 3.3,
      "min": 0,
      "note": "Analog input range is 0 to VDD; both ADC and monitor use the same supply.",
      "unit": "V"
    },
    "input_high_ratio": {
      "basis": "DATASHEET",
      "conditions": {},
      "evidence": {
        "page": 7,
        "source": "source:rohm-bd79124muf-c"
      },
      "min": 0.7,
      "note": "SCL and SDA input high threshold as a fraction of IOVDD. Table conditions: TA -40 to125degC, VDD 2.7-5.25V, IOVDD 1.65-5.25V subject to IOVDD<=VDD, fSCL3.4MHz.",
      "unit": "1"
    },
    "input_low_ratio": {
      "basis": "DATASHEET",
      "conditions": {},
      "evidence": {
        "page": 7,
        "source": "source:rohm-bd79124muf-c"
      },
      "max": 0.3,
      "note": "SCL and SDA input low threshold as a fraction of IOVDD. Table conditions: TA -40 to125degC, VDD 2.7-5.25V, IOVDD 1.65-5.25V subject to IOVDD<=VDD, fSCL3.4MHz.",
      "unit": "1"
    },
    "input_voltage": {
      "basis": "DATASHEET",
      "conditions": {},
      "evidence": {
        "page": 5,
        "source": "source:rohm-bd79124muf-c"
      },
      "max": 5.25,
      "min": 2.7,
      "unit": "V"
    },
    "io_voltage": {
      "basis": "DATASHEET",
      "conditions": {
        "input_voltage": {
          "unit": "V",
          "value": 3.3
        }
      },
      "evidence": {
        "page": 5,
        "source": "source:rohm-bd79124muf-c"
      },
      "max": 3.3,
      "min": 1.65,
      "note": "IOVDD upper limit is VDD; 3.3 V supply specialization of recommended conditions.",
      "unit": "V"
    },
    "resolution": {
      "basis": "DATASHEET",
      "conditions": {},
      "evidence": {
        "page": 6,
        "source": "source:rohm-bd79124muf-c"
      },
      "note": "12-bit resolution, not accuracy. Table typical: TA25degC, fSCL3.4MHz, VDD2.7-5.25V, IOVDD1.65-5.25V subject to IOVDD<=VDD. No 3.3V gain/offset guarantee.",
      "typ": 12,
      "unit": "1"
    },
    "sample_rate": {
      "basis": "DATASHEET",
      "conditions": {},
      "evidence": {
        "page": 5,
        "source": "source:rohm-bd79124muf-c"
      },
      "max": 140000,
      "unit": "Hz"
    }
  },
  "pin_evidence": {
    "basis": "DATASHEET",
    "page": 3,
    "source": "source:rohm-bd79124muf-c"
  },
  "pins": [
    {
      "name": "IN2",
      "number": "1",
      "type": "ANALOG"
    },
    {
      "name": "IN3",
      "number": "2",
      "type": "ANALOG"
    },
    {
      "name": "IN4",
      "number": "3",
      "type": "ANALOG"
    },
    {
      "name": "IN5",
      "number": "4",
      "type": "ANALOG"
    },
    {
      "name": "IN6",
      "number": "5",
      "type": "ANALOG"
    },
    {
      "name": "IN7",
      "number": "6",
      "type": "ANALOG"
    },
    {
      "name": "VDD",
      "number": "7",
      "type": "POWER_IN"
    },
    {
      "name": "TOUT",
      "number": "8",
      "type": "OUTPUT"
    },
    {
      "name": "GND",
      "number": "9",
      "type": "GROUND"
    },
    {
      "name": "IOVDD",
      "number": "10",
      "type": "POWER_IN"
    },
    {
      "name": "ADDR",
      "number": "11",
      "type": "INPUT"
    },
    {
      "name": "ALERT",
      "number": "12",
      "type": "OUTPUT"
    },
    {
      "name": "SCL",
      "number": "13",
      "type": "INPUT"
    },
    {
      "name": "SDA",
      "number": "14",
      "type": "BIDIRECTIONAL"
    },
    {
      "name": "IN0",
      "number": "15",
      "type": "ANALOG"
    },
    {
      "name": "IN1",
      "number": "16",
      "type": "ANALOG"
    },
    {
      "name": "EXP-PAD",
      "number": "EXP-PAD",
      "type": "GROUND"
    }
  ],
  "provenance": {
    "created_by": "agent:/root/implement_pcbknowledge_brief/g2_monitor_author",
    "notes": "p3: EXP-PAD=GND, not17; unused TOUT open, no bypass. p17: ADDR=GND gives0x10. p35: 11ohm/100nF input; 1uF+0.1uF/supply. p36: unused inputs supply/GND; GND selected. ALERT unused: p35 open-drain vs p7 source-current limits; no push-pull claim.",
    "verified_by": [
      "agent:/root/implement_pcbknowledge_brief/g2_source_review"
    ]
  },
  "roles": [
    "adc.i2c"
  ],
  "schema": "pcbknowledge.part.v2",
  "sourcing": {
    "lifecycle": "UNKNOWN"
  },
  "verification": "AGENT_VERIFIED"
}
