{
  "id": "part:yageo-rc0603fr-075k1l",
  "identity_evidence": {
    "page": 1,
    "source": "source:yageo-rc0603fr-075k1l"
  },
  "manufacturer": "Yageo",
  "mpn": "RC0603FR-075K1L",
  "package": "package:chip-0603-yageo-rc",
  "parameters": {
    "power_rating": {
      "basis": "DATASHEET",
      "conditions": {},
      "evidence": {
        "page": 1,
        "source": "source:yageo-rc0603fr-075k1l"
      },
      "max": 0.1,
      "note": "Rated at 70 degC.",
      "unit": "W"
    },
    "resistance": {
      "basis": "DATASHEET",
      "conditions": {},
      "evidence": {
        "page": 1,
        "source": "source:yageo-rc0603fr-075k1l"
      },
      "max": 5151.0,
      "min": 5049.0,
      "typ": 5100,
      "unit": "ohm"
    }
  },
  "pin_evidence": {
    "basis": "STANDARD_CONVENTION",
    "convention": "Unpolarized two-terminal component: terminals numbered 1 and 2.",
    "page": 1,
    "source": "source:yageo-rc0603fr-075k1l"
  },
  "pins": [
    {
      "name": "1",
      "number": "1",
      "type": "PASSIVE"
    },
    {
      "name": "2",
      "number": "2",
      "type": "PASSIVE"
    }
  ],
  "provenance": {
    "created_by": "agent:/root/implement_pcbknowledge_brief/curate_g1_parts",
    "verified_by": [
      "agent:/root/implement_pcbknowledge_brief/curate_g1_parts/curate_g1_mcu_peripherals"
    ]
  },
  "roles": [
    "resistor"
  ],
  "schema": "pcbknowledge.part.v2",
  "sourcing": {
    "lifecycle": "UNKNOWN"
  },
  "verification": "AGENT_VERIFIED"
}
