{
  "id": "part:st-stm32f103c8t6",
  "identity_evidence": {
    "page": 104,
    "source": "source:st-stm32f103"
  },
  "manufacturer": "STMicroelectronics",
  "mpn": "STM32F103C8T6",
  "package": "package:lqfp-48-stm32",
  "parameters": {
    "clock_frequency": {
      "basis": "DATASHEET",
      "conditions": {},
      "evidence": {
        "page": 1,
        "source": "source:st-stm32f103"
      },
      "max": 72000000.0,
      "unit": "Hz"
    },
    "gpio_high_drop": {
      "basis": "DATASHEET",
      "conditions": {
        "TA_max": {
          "unit": "degC",
          "value": 85
        },
        "TA_min": {
          "unit": "degC",
          "value": -40
        },
        "VDD_max": {
          "unit": "V",
          "value": 3.6
        },
        "VDD_min": {
          "unit": "V",
          "value": 2.7
        },
        "output_current": {
          "unit": "A",
          "value": 0.008
        }
      },
      "evidence": {
        "page": 64,
        "source": "source:st-stm32f103"
      },
      "max": 0.4,
      "note": "CMOS GPIO VOH >= VDD-0.4V, up to eight sourcing outputs; strict 2.7<VDD<3.6V. C6 normal operating TA from Table9 p38.",
      "unit": "V"
    },
    "input_voltage": {
      "basis": "DATASHEET",
      "conditions": {},
      "evidence": {
        "page": 1,
        "source": "source:st-stm32f103"
      },
      "max": 3.6,
      "min": 2,
      "unit": "V"
    }
  },
  "pin_evidence": {
    "basis": "DATASHEET",
    "page": 26,
    "source": "source:st-stm32f103"
  },
  "pins": [
    {
      "name": "VBAT",
      "number": "1",
      "type": "POWER_IN"
    },
    {
      "name": "PC13-TAMPER-RTC",
      "number": "2",
      "type": "BIDIRECTIONAL"
    },
    {
      "name": "PC14-OSC32_IN",
      "number": "3",
      "type": "BIDIRECTIONAL"
    },
    {
      "name": "PC15-OSC32_OUT",
      "number": "4",
      "type": "BIDIRECTIONAL"
    },
    {
      "name": "PD0-OSC_IN",
      "number": "5",
      "type": "INPUT"
    },
    {
      "name": "PD1-OSC_OUT",
      "number": "6",
      "type": "OUTPUT"
    },
    {
      "name": "NRST",
      "number": "7",
      "type": "BIDIRECTIONAL"
    },
    {
      "name": "VSSA",
      "number": "8",
      "type": "GROUND"
    },
    {
      "name": "VDDA",
      "number": "9",
      "type": "POWER_IN"
    },
    {
      "functions": [
        {
          "evidence": [
            {
              "page": 29,
              "source": "source:st-stm32f103"
            },
            {
              "page": 161,
              "source": "source:st-rm0008"
            }
          ],
          "name": "GPIO_PUSH_PULL"
        }
      ],
      "name": "PA0-WKUP",
      "number": "10",
      "type": "BIDIRECTIONAL"
    },
    {
      "functions": [
        {
          "evidence": [
            {
              "page": 29,
              "source": "source:st-stm32f103"
            },
            {
              "page": 161,
              "source": "source:st-rm0008"
            }
          ],
          "name": "GPIO_PUSH_PULL"
        }
      ],
      "name": "PA1",
      "number": "11",
      "type": "BIDIRECTIONAL"
    },
    {
      "name": "PA2",
      "number": "12",
      "type": "BIDIRECTIONAL"
    },
    {
      "name": "PA3",
      "number": "13",
      "type": "BIDIRECTIONAL"
    },
    {
      "functions": [
        {
          "evidence": [
            {
              "page": 29,
              "source": "source:st-stm32f103"
            },
            {
              "page": 161,
              "source": "source:st-rm0008"
            }
          ],
          "name": "GPIO_PUSH_PULL"
        }
      ],
      "name": "PA4",
      "number": "14",
      "type": "BIDIRECTIONAL"
    },
    {
      "functions": [
        {
          "evidence": [
            {
              "page": 29,
              "source": "source:st-stm32f103"
            }
          ],
          "name": "SPI1_SCK"
        }
      ],
      "name": "PA5",
      "number": "15",
      "type": "BIDIRECTIONAL"
    },
    {
      "name": "PA6",
      "number": "16",
      "type": "BIDIRECTIONAL"
    },
    {
      "functions": [
        {
          "evidence": [
            {
              "page": 29,
              "source": "source:st-stm32f103"
            }
          ],
          "name": "SPI1_MOSI"
        }
      ],
      "name": "PA7",
      "number": "17",
      "type": "BIDIRECTIONAL"
    },
    {
      "name": "PB0",
      "number": "18",
      "type": "BIDIRECTIONAL"
    },
    {
      "name": "PB1",
      "number": "19",
      "type": "BIDIRECTIONAL"
    },
    {
      "name": "PB2",
      "number": "20",
      "type": "BIDIRECTIONAL"
    },
    {
      "name": "PB10",
      "number": "21",
      "type": "BIDIRECTIONAL"
    },
    {
      "name": "PB11",
      "number": "22",
      "type": "BIDIRECTIONAL"
    },
    {
      "name": "VSS_1",
      "number": "23",
      "type": "GROUND"
    },
    {
      "name": "VDD_1",
      "number": "24",
      "type": "POWER_IN"
    },
    {
      "name": "PB12",
      "number": "25",
      "type": "BIDIRECTIONAL"
    },
    {
      "name": "PB13",
      "number": "26",
      "type": "BIDIRECTIONAL"
    },
    {
      "name": "PB14",
      "number": "27",
      "type": "BIDIRECTIONAL"
    },
    {
      "name": "PB15",
      "number": "28",
      "type": "BIDIRECTIONAL"
    },
    {
      "name": "PA8",
      "number": "29",
      "type": "BIDIRECTIONAL"
    },
    {
      "functions": [
        {
          "evidence": [
            {
              "page": 31,
              "source": "source:st-stm32f103"
            },
            {
              "page": 161,
              "source": "source:st-rm0008"
            }
          ],
          "name": "GPIO_PUSH_PULL"
        },
        {
          "evidence": [
            {
              "page": 31,
              "source": "source:st-stm32f103"
            }
          ],
          "name": "UART_TX"
        }
      ],
      "name": "PA9",
      "number": "30",
      "type": "BIDIRECTIONAL"
    },
    {
      "name": "PA10",
      "number": "31",
      "type": "BIDIRECTIONAL"
    },
    {
      "functions": [
        {
          "evidence": [
            {
              "page": 31,
              "source": "source:st-stm32f103"
            },
            {
              "page": 33,
              "source": "source:st-stm32f103"
            },
            {
              "page": 185,
              "source": "source:st-rm0008"
            }
          ],
          "name": "CAN_RX"
        }
      ],
      "name": "PA11",
      "number": "32",
      "type": "BIDIRECTIONAL"
    },
    {
      "functions": [
        {
          "evidence": [
            {
              "page": 31,
              "source": "source:st-stm32f103"
            },
            {
              "page": 33,
              "source": "source:st-stm32f103"
            },
            {
              "page": 185,
              "source": "source:st-rm0008"
            }
          ],
          "name": "CAN_TX"
        }
      ],
      "name": "PA12",
      "number": "33",
      "type": "BIDIRECTIONAL"
    },
    {
      "name": "PA13",
      "number": "34",
      "type": "BIDIRECTIONAL"
    },
    {
      "name": "VSS_2",
      "number": "35",
      "type": "GROUND"
    },
    {
      "name": "VDD_2",
      "number": "36",
      "type": "POWER_IN"
    },
    {
      "name": "PA14",
      "number": "37",
      "type": "BIDIRECTIONAL"
    },
    {
      "name": "PA15",
      "number": "38",
      "type": "BIDIRECTIONAL"
    },
    {
      "name": "PB3",
      "number": "39",
      "type": "BIDIRECTIONAL"
    },
    {
      "name": "PB4",
      "number": "40",
      "type": "BIDIRECTIONAL"
    },
    {
      "name": "PB5",
      "number": "41",
      "type": "BIDIRECTIONAL"
    },
    {
      "name": "PB6",
      "number": "42",
      "type": "BIDIRECTIONAL"
    },
    {
      "name": "PB7",
      "number": "43",
      "type": "BIDIRECTIONAL"
    },
    {
      "name": "BOOT0",
      "number": "44",
      "type": "INPUT"
    },
    {
      "name": "PB8",
      "number": "45",
      "type": "BIDIRECTIONAL"
    },
    {
      "name": "PB9",
      "number": "46",
      "type": "BIDIRECTIONAL"
    },
    {
      "name": "VSS_3",
      "number": "47",
      "type": "GROUND"
    },
    {
      "name": "VDD_3",
      "number": "48",
      "type": "POWER_IN"
    }
  ],
  "provenance": {
    "created_by": "agent:/root/implement_pcbknowledge_brief/curate_g1_parts/curate_g1_mcu_peripherals",
    "notes": "GPIO: agent:/root/implement_pcbknowledge_brief/g2_mcu_switch_author. T5 PA4 GPIO, PA5 SCK, PA7 MOSI and T7 CAN_RX pin32/CAN_TX pin33: agent:/root/research_fixed_themes; scoped source review retained.",
    "verified_by": [
      "agent:/root/implement_pcbknowledge_brief/g2_source_review",
      "agent:/root/implement_reference_layout/stage12_review"
    ]
  },
  "roles": [
    "mcu.32-bit"
  ],
  "schema": "pcbknowledge.part.v2",
  "sourcing": {
    "lifecycle": "UNKNOWN"
  },
  "verification": "AGENT_VERIFIED"
}
